{
  "issuer": {
    "id": "https://jargon.sh",
    "address": {
      "street": "The quick brown fox jumps over the lazy dog.",
      "city": "The quick brown fox jumps over the lazy dog.",
      "state": "The quick brown fox jumps over the lazy dog.",
      "zip": 12345
    }
  },
  "issuanceDate": "1970-01-01T00:00:00Z",
  "credentialSubject": {
    "contractNumber": "The quick brown fox jumps over the lazy dog.",
    "invoiceNumber": "The quick brown fox jumps over the lazy dog.",
    "issueDate": "1970-01-01",
    "buyer": {
      "id": "https://jargon.sh",
      "address": {
        "street": "The quick brown fox jumps over the lazy dog.",
        "city": "The quick brown fox jumps over the lazy dog.",
        "state": "The quick brown fox jumps over the lazy dog.",
        "zip": 12345
      }
    },
    "invoicee": {
      "id": "https://jargon.sh",
      "address": {
        "street": "The quick brown fox jumps over the lazy dog.",
        "city": "The quick brown fox jumps over the lazy dog.",
        "state": "The quick brown fox jumps over the lazy dog.",
        "zip": 12345
      }
    },
    "shipToParty": {
      "id": "https://jargon.sh",
      "address": {
        "street": "The quick brown fox jumps over the lazy dog.",
        "city": "The quick brown fox jumps over the lazy dog.",
        "state": "The quick brown fox jumps over the lazy dog.",
        "zip": 12345
      }
    },
    "seller": {
      "id": "https://jargon.sh",
      "address": {
        "street": "The quick brown fox jumps over the lazy dog.",
        "city": "The quick brown fox jumps over the lazy dog.",
        "state": "The quick brown fox jumps over the lazy dog.",
        "zip": 12345
      }
    },
    "placeOfDelivery": {
      "unlocode": "https://jargon.sh",
      "address": {
        "street": "The quick brown fox jumps over the lazy dog.",
        "city": "The quick brown fox jumps over the lazy dog.",
        "state": "The quick brown fox jumps over the lazy dog.",
        "zip": 12345
      }
    },
    "baseportUnloadingLocation": {
      "unlocode": "https://jargon.sh",
      "address": {
        "street": "The quick brown fox jumps over the lazy dog.",
        "city": "The quick brown fox jumps over the lazy dog.",
        "state": "The quick brown fox jumps over the lazy dog.",
        "zip": 12345
      }
    },
    "transportContractDocumentConditions": "The quick brown fox jumps over the lazy dog."
  },
  "id": "https://jargon.sh"
}